Book Id,Title,Author,Author l-f,Additional Authors,ISBN,ISBN13,My Rating,Publisher,Binding,Number of Pages,Year Published,Original Publication Year,Date Read,Date Added,Bookshelves,Bookshelves with positions,Exclusive Shelf,My Review,Spoiler,Private Notes,Read Count,Owned Copies,is_dnf,Description,Genres_Enriched,All_Tags
28187,"The Lightning Thief (Percy Jackson and the Olympians, #1)",Rick Riordan,"Riordan, Rick",,786838655.0,9780786838653.0,4,Disney Hyperion Books,Paperback,377.0,2006.0,2005.0,2016/01/12,2020/05/20,,,read,,,,2,0,False,"Percy Jackson and the Lightning Thief is the first bestselling book in Rick Riordan's phenomenally successful Percy Jackson series. Half boy. Half God. ALL Hero. Look, I didn't want to be a half-blood. I never asked to be the son of a Greek God. I was just a normal kid, going to school, playing basketball, skateboarding. The usual. Until I accidentally vaporized my maths teacher. Now I spend my time battling monsters and generally trying to stay alive. This is the one where Zeus, God of the Sky, thinks I've stolen his lightning bolt - and making Zeus angry is a very bad idea. ----- Rick Riordan has now sold an incredible 55 million copies of his books worldwide 'It's Buffy meets Artemis Fowl. Thumbs up' Sunday Times ----- Books by Rick Riordan: The Percy Jackson series: Percy Jackson and the Lightning Thief Percy Jackson and the Sea of Monsters Percy Jackson and the Titan's Curse Percy Jackson and the Battle of the Labyrinth Percy Jackson and the Last Olympian Percy Jackson: The Demigod Files The Heroes of Olympus series: The Lost Hero The Son Of Neptune The Mark of Athena The Heroes of Olympus: The Demigod Files The Kane Chronicles series: The Red Pyramid The Throne of Fire The Serpent's Shadow The Magnus Chase series: Magnus Chase and the Sword of Summer Magnus Chase and the Hammer of Thor Magnus Chase and the Ship of the Dead The Trials of Apollo series: The Dark Prophecy The Hidden Oracle The Burning Maze",Adventure stories,|Adventure stories
58034464,"Nós somos a cidade (Grandes Cidades, #1)",N.K. Jemisin,"Jemisin, N.K.",Helen Pandolfi,8556511198.0,9788556511195.0,5,Suma,Paperback,334.0,2021.0,2020.0,2021/10/04,2020/10/27,"read-2021, favorites","read-2021 (#111), favorites (#6)",read,,,,1,0,False,Descrição não disponível (API 404),"read-2021, favorites","read-2021, favorites|read-2021, favorites"
50027029,"You Deserve Each Other (You Deserve Each Other, #1)",Sarah Hogle,"Hogle, Sarah",,,,4,G.P. Putnam's Sons,Kindle Edition,368.0,2020.0,2020.0,2022/04/20,2022/01/24,"romance, read-2022","romance (#34), read-2022 (#46)",read,,,,1,0,False,Descrição não disponível (API 404),"romance, read-2022","romance, read-2022|romance, read-2022"
56978042,Icebreaker,A.L. Graziadei,"Graziadei, A.L.",,1250777119.0,9781250777119.0,4,Godwin Books,Hardcover,320.0,2022.0,2022.0,2022/04/18,2022/04/15,"read-2022, romance","read-2022 (#45), romance (#44)",read,,,,1,0,False,Descrição não disponível (API 404),"read-2022, romance","read-2022, romance|read-2022, romance"
56235566,아기가 생겼어요 2,NOT A BOOK,"BOOK, NOT A",,,,4,Tapas ,Web Comic,1080.0,2020.0,,2022/04/17,2022/04/17,"mangas, read-2022","mangas (#111), read-2022 (#44)",read,,,,1,0,False,Descrição não disponível (API 404),"mangas, read-2022","mangas, read-2022|mangas, read-2022"
53457092,"Six Crimson Cranes (Six Crimson Cranes, #1)",Elizabeth Lim,"Lim, Elizabeth",,593300939.0,9780593300930.0,4,Knopf,ebook,454.0,2021.0,2021.0,2022/04/16,2020/10/31,read-2022,read-2022 (#42),read,"i’m literally losing my mind! this book is so insanely good, every time i picked it up i couldn’t stop until i had read at least 100 more pages!!<br/><br/>i love shiori and watching her grow as a person throughout the book was so beautiful, it made me like her even more! the plot was very intriguing and surprising to me. the romances were so cute, i can’t wait to see more of it in book two!!",,,1,0,False,Descrição não disponível (API 404),read-2022,read-2022|read-2022
55711519,"Haikyu!!, Vol. 45",Haruichi Furudate,"Furudate, Haruichi",,197472364.0,9781974723645.0,5,VIZ Media LLC,Paperback,224.0,2021.0,2020.0,2020/07/30,2021/01/22,"read-2020, mangas","read-2020 (#120), mangas (#20)",read,,,,2,0,False,Descrição não disponível (API 404),"read-2020, mangas","read-2020, mangas|read-2020, mangas"
55711499,"Haikyu!!, Vol. 44",Haruichi Furudate,"Furudate, Haruichi",,197472283.0,9781974722839.0,5,VIZ Media LLC,Paperback,192.0,2021.0,2020.0,2020/07/30,2021/01/22,"read-2020, mangas","read-2020 (#119), mangas (#19)",read,,,,2,0,False,Descrição não disponível (API 404),"read-2020, mangas","read-2020, mangas|read-2020, mangas"
49438663,"Nick and Charlie (Solitaire, #1.5)",Alice Oseman,"Oseman, Alice",,8389667.0,9780008389666.0,5,Harper Collins Children’s Books,Paperback,159.0,2020.0,2015.0,2020/02/01,2020/02/04,read-2020,read-2020 (#52),read,,,,3,0,False,Descrição não disponível (API 404),read-2020,read-2020|read-2020
54303333,"Haikyu!!, Vol. 43",Haruichi Furudate,"Furudate, Haruichi",,1974720985.0,9781974720989.0,5,VIZ Media LLC,Paperback,216.0,2021.0,2020.0,2020/07/30,2021/01/22,"read-2020, mangas","read-2020 (#118), mangas (#18)",read,,,,2,0,False,Descrição não disponível (API 404),"read-2020, mangas","read-2020, mangas|read-2020, mangas"
36223860,"Artificial Condition (The Murderbot Diaries, #2)",Martha Wells,"Wells, Martha",,,,4,Tor.com,Hardcover,158.0,2018.0,2018.0,2022/04/12,2022/04/10,read-2022,read-2022 (#41),read,,,,1,0,False,Descrição não disponível (API 404),read-2022,read-2022|read-2022
32758901,"All Systems Red (The Murderbot Diaries, #1)",Martha Wells,"Wells, Martha",,,,4,Tor.com,ebook,144.0,2017.0,2017.0,2022/04/10,2022/04/07,read-2022,read-2022 (#40),read,"all systems red really made my heart hurt, who knew a robot going through the mortifying ordeal of being known would knock me down?? not me.",,,1,0,False,Descrição não disponível (API 404),read-2022,read-2022|read-2022
51574372,"Heartstopper: Volume Four (Heartstopper, #4)",Alice Oseman,"Oseman, Alice",,144495279.0,9781444952797.0,5,HACHETTE INTL,Paperback,384.0,2021.0,2021.0,2020/11/11,2020/01/09,"read-2020, comics","read-2020 (#20), comics (#30)",read,,,,2,0,False,Descrição não disponível (API 404),"read-2020, comics","read-2020, comics|read-2020, comics"
43449920,"Heartstopper: Volume Three (Heartstopper, #3)",Alice Oseman,"Oseman, Alice",,,,5,Hodder Children's Books,Paperback,384.0,2020.0,2020.0,2019/02/01,2019/12/31,comics,comics (#29),read,,,,2,0,False,Descrição não disponível (API 404),comics,comics|comics
43307358,"Heartstopper: Volume Two (Heartstopper, #2)",Alice Oseman,"Oseman, Alice",,1444951408.0,9781444951400.0,5,Hodder Children's Books,Paperback,320.0,2019.0,2019.0,2018/09/01,2019/12/31,comics,comics (#28),read,,,,2,0,False,Descrição não disponível (API 404),comics,comics|comics
42189109,"Heartstopper: Volume One (Heartstopper, #1)",Alice Oseman,"Oseman, Alice",,1444951386.0,9781444951387.0,5,HACHETTE INTL,Paperback,263.0,2019.0,2018.0,2018/09/01,2018/11/22,comics,comics (#27),read,,,,2,0,False,Descrição não disponível (API 404),comics,comics|comics
40728791,Orgulho e Preconceito,Jane Austen,"Austen, Jane",Roberto Leal Ferreira,8544001823.0,9788544001820.0,5,Martin Claret,Hardcover,424.0,2018.0,1813.0,2022/03/14,2021/01/05,"read-2022, romance","read-2022 (#30), romance (#38)",read,"yeah, it is as good as everyone says it is. ",,,1,0,False,Descrição não disponível (API 404),"read-2022, romance","read-2022, romance|read-2022, romance"
53217284,"A Marvellous Light (The Last Binding, #1)",Freya Marske,"Marske, Freya",,1250788897.0,9781250788894.0,4,Tordotcom,Kindle Edition,377.0,2021.0,2021.0,2022/03/10,2021/01/26,"read-2022, romance","read-2022 (#29), romance (#37)",read,"a marvellous light can convince anyone that love exists! i was so invested in the story from the very start, the mysteries and the magic system are so interesting and the characters of this book… i have no words. i can’t wait for maude’s book!",,,1,0,False,Descrição não disponível (API 404),"read-2022, romance","read-2022, romance|read-2022, romance"
53205912,"Winter's Orbit (Winter's Orbit, #1)",Everina Maxwell,"Maxwell, Everina",,1250758831.0,9781250758835.0,4,Tor Books,Hardcover,432.0,2021.0,2021.0,2022/03/03,2021/02/10,read-2022,read-2022 (#26),read,,,,1,0,False,Descrição não disponível (API 404),read-2022,read-2022|read-2022
58219311,呪術廻戦 18 [Jujutsu Kaisen 18],Gege Akutami,"Akutami, Gege",芥見下々,4088828488.0,9784088828480.0,4,集英社,Paperback,192.0,2021.0,2021.0,2021/10/04,2022/01/31,"mangas, read-2021","mangas (#109), read-2021 (#137)",read,,,,1,0,False,Descrição não disponível (API 404),"mangas, read-2021","mangas, read-2021|mangas, read-2021"
59366075,"Jujutsu Kaisen, Vol. 17",Gege Akutami,"Akutami, Gege",,1974732339.0,9781974732333.0,4,VIZ Media LLC,Paperback,200.0,2022.0,2021.0,2022/01/31,2022/01/31,"mangas, read-2021","mangas (#108), read-2021 (#136)",read,,,,1,0,False,Descrição não disponível (API 404),"mangas, read-2021","mangas, read-2021|mangas, read-2021"
57860912,"Sasaki and Miyano, Vol. 4",Shou Harusono,"Harusono, Shou",,197532384.0,9781975323844.0,4,Yen Press,Paperback,162.0,2021.0,2018.0,2022/01/29,2022/01/29,"mangas, read-2022","mangas (#103), read-2022 (#20)",read,,,,1,0,False,Descrição não disponível (API 404),"mangas, read-2022","mangas, read-2022|mangas, read-2022"
56817473,"Sasaki and Miyano, Vol. 3",Shou Harusono,"Harusono, Shou",,1975323823.0,9781975323820.0,4,Yen Press,Paperback,146.0,2021.0,2018.0,2022/01/29,2022/01/28,"mangas, read-2022","mangas (#102), read-2022 (#18)",read,,,,1,0,False,Descrição não disponível (API 404),"mangas, read-2022","mangas, read-2022|mangas, read-2022"
56978115,The Red Palace,June Hur,"Hur, June",,1250800552.0,9781250800558.0,5,Feiwel & Friends,Hardcover,321.0,2022.0,2022.0,2022/01/25,2021/08/20,"favorites, read-2022","favorites (#4), read-2022 (#14)",read,"i’m so obsessed with this book, it’s everything i hoped for and more!! one of my most expected of 2022 and it absolutely did not disappoint. <br/><br/>i read it all in one sitting, this story wouldn’t let me go. i love hyeon and eojin so much, they made me believe in love again. the plot was just as interesting as the characters were to me, june hur’s mysteries always surprise me.<br/><br/>the red palace’s story is really compelling, it made me feel like i put my heart inside a blender while also giving me a warm hug. which is everything i want in a book, honestly.",,,1,0,False,Descrição não disponível (API 404),"favorites, read-2022","favorites, read-2022|favorites, read-2022"
59126141,Quem matou Capitão Gancho?,Anna Anchieta,"Anchieta, Anna",,,,5,,Kindle Edition,422.0,2021.0,2020.0,2021/04/06,2021/03/10,"read-2021, favorites","read-2021 (#56), favorites (#1)",read,,,,2,0,False,Descrição não disponível (API 404),"read-2021, favorites","read-2021, favorites|read-2021, favorites"
38251245,"A Question of Holmes (Charlotte Holmes, #4)",Brittany Cavallaro,"Cavallaro, Brittany",,6284024.0,9780062840240.0,4,Katherine Tegen Books,ebook,320.0,2019.0,2019.0,2022/01/13,2022/01/12,read-2022,read-2022 (#5),read,"i am literally crying, i feel like my heart is breaking and i already miss jamie and charlotte.",,,1,0,False,Descrição não disponível (API 404),read-2022,read-2022|read-2022
33810737,"The Case for Jamie (Charlotte Holmes, #3)",Brittany Cavallaro,"Cavallaro, Brittany",,62398970.0,9780062398970.0,4,Katherine Tegen Books,Hardcover,349.0,2018.0,2018.0,2022/01/12,2022/01/12,read-2022,read-2022 (#4),read,,,,1,0,False,Descrição não disponível (API 404),read-2022,read-2022|read-2022
50523477,"The Jasmine Throne (The Burning Kingdoms, #1)",Tasha Suri,"Suri, Tasha",,356515648.0,9780356515649.0,4,Orbit,Paperback,533.0,2021.0,2021.0,2022/01/06,2020/11/14,read-2022,read-2022 (#1),read,,,,1,0,False,Descrição não disponível (API 404),read-2022,read-2022|read-2022
50056075,"The Heart Principle (The Kiss Quotient, #3)",Helen  Hoang,"Hoang, Helen",,451490843.0,9780451490841.0,4,Berkley,Paperback,343.0,2021.0,2021.0,2021/12/14,2021/12/14,"romance, read-2021","romance (#30), read-2021 (#134)",read,,,,1,0,False,Descrição não disponível (API 404),"romance, read-2021","romance, read-2021|romance, read-2021"
39338454,"The Bride Test (The Kiss Quotient, #2)",Helen  Hoang,"Hoang, Helen",,451490827.0,9780451490827.0,4,Berkley,Paperback,320.0,2019.0,2019.0,2021/12/14,2021/12/14,"romance, read-2021","romance (#29), read-2021 (#133)",read,,,,1,0,False,Descrição não disponível (API 404),"romance, read-2021","romance, read-2021|romance, read-2021"
36199084,"The Kiss Quotient (The Kiss Quotient, #1)",Helen  Hoang,"Hoang, Helen",,451490819.0,,4,Berkley,Kindle Edition,333.0,2018.0,2018.0,2021/12/14,2021/10/04,"romance, read-2021","romance (#15), read-2021 (#132)",read,i’m OBSESSED i love stella and michael so much!!!!,,,1,0,False,Descrição não disponível (API 404),"romance, read-2021","romance, read-2021|romance, read-2021"
48727813,"She Who Became the Sun (The Radiant Emperor, #1)",Shelley Parker-Chan,"Parker-Chan, Shelley",,1250621798.0,9781250621795.0,5,Tor Books,Kindle Edition,416.0,2021.0,2021.0,2021/08/24,2020/11/11,read-2021,read-2021 (#98),read,"it took me a while to really get into it and get used to the long paragraphs, but when i did, i finished in a day! this book took me on a trip and really hurt my feelings so much i cannot even explain. 10/10, would recommend it.<br/><br/>the characters are really well done, you can hate and love all of them, they had flaws and strengths which made them really interesting and their journey surprised me a lot, i can’t wait to see where they’ll end up in the sequel. <br/><br/>i really loved this book, it has all the heart-shattering romance, plot twists, amazing worldbuilding and political intrigue you could want.",,,1,0,False,Descrição não disponível (API 404),read-2021,read-2021|read-2021
59125676,"Haikyu!!, Vol. 2",Haruichi Furudate,"Furudate, Haruichi",,6555942053.0,9786555942057.0,5,JBC,Paperback,400.0,2021.0,,2021/12/01,2021/11/23,"mangas, read-2021","mangas (#99), read-2021 (#126)",read,,,,1,0,False,Descrição não disponível (API 404),"mangas, read-2021","mangas, read-2021|mangas, read-2021"
50892338,"Legendborn (The Legendborn Cycle, #1)",Tracy Deonn,"Deonn, Tracy",,1534441603.0,9781534441606.0,5,Margaret K. McElderry Books,Hardcover,502.0,2020.0,2020.0,2021/05/07,2020/12/17,read-2021,read-2021 (#66),read,"this book was so perfect, i couldn’t stop thinking about it every second i wasn’t reading it! bree might be one of my favorite protagonists i’ve ever read, she is smart, interesting and funny. the side characters and love interests are also a great part of the story and i actually liked this “love triangle”, surprisingly. not to mention the plot and the twists made me gasp out loud quite a few times!",,,2,0,False,Descrição não disponível (API 404),read-2021,read-2021|read-2021
50158990,"The Shadow of Kyoshi (The Kyoshi Novels, #2)",F.C. Yee,"Yee, F.C.",Michael Dante DiMartino,1419735055.0,9781419735059.0,5,Amulet Books,Hardcover,341.0,2020.0,2020.0,2021/11/17,2021/03/10,read-2021,read-2021 (#124),read,"i would lay down my life for kyoshi part 2.<br/><br/>but seriously, the shadow of kyoshi is an incredible ending to kyoshi’s journey into becoming the avatar, even if it leaves me wanting to see all her future adventures! this book made me love kyoshi even more than i already did.",,,1,0,False,Descrição não disponível (API 404),read-2021,read-2021|read-2021
57302436,文豪ストレイドッグス ＳＴＯＲＭ ＢＲＩＮＧＥＲ [Bungō Stray Dogs: Storm Bringer],Kafka Asagiri,"Asagiri, Kafka","Sango Harukawa, 朝霧カフカ, 春河３５",4041085179.0,9784041085172.0,5,Kadokawa,Paperback,484.0,2021.0,2021.0,2021/10/30,2021/10/20,"mangas, read-2021","mangas (#96), read-2021 (#122)",read,,,,1,0,False,Descrição não disponível (API 404),"mangas, read-2021","mangas, read-2021|mangas, read-2021"
41832245,人渣反派自救系统 [The Scum Villain’s Self-Saving System],Mò Xiāng Tóng Xiù,"Xiù, Mò Xiāng Tóng",墨香铜臭,,,4,jjwxc,,1114.0,2015.0,2015.0,2021/10/24,2021/01/02,"cnovels, read-2021","cnovels (#4), read-2021 (#121)",read,,,,1,0,False,Descrição não disponível (API 404),"cnovels, read-2021","cnovels, read-2021|cnovels, read-2021"
55255067,Covenant,explodikid,"explodikid, explodikid",,,,4,Line Webtoon,Webtoon,,2020.0,2020.0,2021/10/16,2021/10/15,"comics, read-2021","comics (#26), read-2021 (#120)",read,,,,1,0,False,Descrição não disponível (API 404),"comics, read-2021","comics, read-2021|comics, read-2021"
41716919,"Jade War (The Green Bone Saga, #2)",Fonda Lee,"Lee, Fonda",,316440922.0,9780316440929.0,5,Orbit,Hardcover,587.0,2019.0,2019.0,2021/06/05,2021/05/28,read-2021,read-2021 (#73),read,"WOW! i don’t know what to say about the green bone saga, it consumed my life from the moment i picked up jade city. every character and their point of view is interesting and impossible to not love. this book is filled with even more action and unpredictable twists than the first and a plot that makes you lay up all night thinking about it (trust me), i’m so excited for jade legacy! i can’t believe i have to wait until december after an ending like THAT!",,,1,0,False,Descrição não disponível (API 404),read-2021,read-2021|read-2021
52757974,"Spy x Family, Vol. 1",Tatsuya Endo,"Endo, Tatsuya","Casey Loe, Rina Mapa, Jimmy Presler",1974715469.0,9781974715466.0,4,VIZ Media LLC,Paperback,220.0,2020.0,2019.0,2021/08/03,2021/01/11,"mangas, read-2021","mangas (#79), read-2021 (#81)",read,"the forger family means everything to me! in just one volume they’ve captured my heart, this is a perfect mix of wholesomeness, action and comedy. there’s also a plot brewing behind all the cuteness.",,,1,0,False,Descrição não disponível (API 404),"mangas, read-2021","mangas, read-2021|mangas, read-2021"
52459864,"Iron Widow (Iron Widow, #1)",Xiran Jay Zhao,"Zhao, Xiran Jay",,735269939.0,9780735269934.0,5,Penguin Teen,Hardcover,394.0,2021.0,2021.0,2021/05/21,2020/11/03,read-2021,read-2021 (#69),read,"this was one of my most expected books of 2021 and i’m not disappointed at all! i can’t think of anything i didn’t like in this book.<br/><br/>the main character, wu zetian, is absolutely delightful to read, she is the perfect mix of absolutely insane, funny, angry, god-like powerful and smart. the characters (impossible to choose any over the other, they’re all extremely interesting and fun in their own way, i’m excited for where their development is going in the next book), the romance (the bisexual polyamorous relationship i didn’t know i needed!) and the plot (mind-boggling! i’m not a plot person and i was super into it!) are all equally important and thrilling and the ending left me wanting more immediately!<br/><br/>i could not put the book down while i read it (which is why i’m writing the review 04:00AM...). i very much recommend this book and can’t wait for whatever else zhao publishes!<br/><br/>[ARC provided by Netgalley]",,,3,0,False,Descrição não disponível (API 404),read-2021,read-2021|read-2021
41104164,"The Rise of Kyoshi (The Kyoshi Novels, #1)",F.C. Yee,"Yee, F.C.",Michael Dante DiMartino,1419735047.0,9781419735042.0,5,Amulet Books,Hardcover,442.0,2019.0,2019.0,2021/03/10,2020/05/16,read-2021,read-2021 (#32),read,i would lay down my life for kyoshi ,,,1,0,False,Descrição não disponível (API 404),read-2021,read-2021|read-2021
49976087,"Take a Hint, Dani Brown (The Brown Sisters, #2)",Talia Hibbert,"Hibbert, Talia",,62941259.0,9780062941251.0,4,Avon,ebook,400.0,2020.0,2020.0,2021/05/03,2021/04/02,"read-2021, romance","read-2021 (#62), romance (#2)",read,,,,1,0,False,Descrição não disponível (API 404),"read-2021, romance","read-2021, romance|read-2021, romance"
39085455,The Taking of Jake Livingston,Ryan Douglass,"Douglass, Ryan",,198481253.0,9781984812537.0,4,Putnam,Hardcover,246.0,2021.0,2021.0,2021/09/22,2021/02/04,read-2021,read-2021 (#101),read,"THE TAKING OF JAKE LIVINGSTON SCARED ME SO MUCH!! i’m a huge wimp and really afraid of ghosts but i don’t regret reading this! this book was the perfect mix of terrifying and cute and emotional. i was crying of fear and feels! the characters are so unique and special, they took over my heart and i was fearing/cheering for them the entire time. this book sets a spooky vibe perfectly, i really love it!",,,1,0,False,Descrição não disponível (API 404),read-2021,read-2021|read-2021
45044785,"The Silvered Serpents (The Gilded Wolves, #2)",Roshani Chokshi,"Chokshi, Roshani",,1250144574.0,9781250144577.0,4,Wednesday Books,Hardcover,406.0,2020.0,2020.0,2020/10/02,2020/09/28,read-2020,read-2020 (#26),read,,,,1,0,False,Descrição não disponível (API 404),read-2020,read-2020|read-2020
39863498,"The Gilded Wolves (The Gilded Wolves, #1)",Roshani Chokshi,"Chokshi, Roshani",,125014454.0,9781250144546.0,4,Wednesday Books,Hardcover,388.0,2019.0,2019.0,2020/09/29,2020/03/31,read-2020,read-2020 (#28),read,,,,1,0,False,Descrição não disponível (API 404),read-2020,read-2020|read-2020
45681895,"The Bronzed Beasts (The Gilded Wolves, #3)",Roshani Chokshi,"Chokshi, Roshani",,1250144604.0,9781250144607.0,4,Wednesday Books,Hardcover,385.0,2021.0,2021.0,2021/07/30,2020/09/28,read-2021,read-2021 (#100),read,,,,1,0,False,Descrição não disponível (API 404),read-2021,read-2021|read-2021
43587154,"Jade City (The Green Bone Saga, #1)",Fonda Lee,"Lee, Fonda",,316440884.0,9780316440882.0,5,Orbit,Paperback,540.0,2018.0,2017.0,2021/05/28,2020/11/14,read-2021,read-2021 (#72),read,,,,2,0,False,Descrição não disponível (API 404),read-2021,read-2021|read-2021
57611989,"Batman: Urban Legends, Vol. 1",Chip Zdarsky,"Zdarsky, Chip","Matthew Rosenberg, Ben Abernathy, Jessica Chen, Dave Wielgosz, Eddy Barrows, Ryan Benjamin, Jesús Merino, Marcus To, Oclair Albert, Eber Ferreira, Julio Ferreira, Diogenes Neves, Antonio Fabela, Adriano Lucas, Jordie Bellaire, Romulo Fajardo Jr., David Finch, Hicham Habchi - Pyroow, Klaus Janson, Annette Kwok, Danny Miki, Jorge Molina, John Romita Jr., Alejandro Sánchez, Nicola Scott",1779512171.0,9781779512178.0,4,DC Comics,Paperback,264.0,2021.0,2021.0,2021/08/10,2021/07/13,comics,comics (#24),read,four stars just for tim drake and his new boyfriend!!,,,1,0,False,Descrição não disponível (API 404),comics,comics|comics
42190679,Grandmaster of Demonic Cultivation,Mò Xiāng Tóng Xiù,"Xiù, Mò Xiāng Tóng",墨香铜臭,,,5,jjwxc,Webnovel,1078.0,2016.0,2015.0,2021/08/08,2021/02/09,"cnovels, read-2021","cnovels (#1), read-2021 (#84)",read,,,,1,0,False,Descrição não disponível (API 404),"cnovels, read-2021","cnovels, read-2021|cnovels, read-2021"
56159560,Heaven Official's Blessing,Mò Xiāng Tóng Xiù,"Xiù, Mò Xiāng Tóng",墨香铜臭,,,5,,ebook,2758.0,,2017.0,2020/12/08,2020/11/06,"read-2020, cnovels, favorites","read-2020 (#14), cnovels (#8), favorites (#3)",read,,,,1,0,False,Descrição não disponível (API 404),"read-2020, cnovels, favorites","read-2020, cnovels, favorites|read-2020, cnovels, favorites"
50891127,"Spy x Family, Vol. 2",Tatsuya Endo,"Endo, Tatsuya",Casey Loe,1974717240.0,9781974717248.0,4,VIZ Media LLC,Paperback,200.0,2020.0,2019.0,2021/08/03,2021/08/03,"mangas, read-2021","mangas (#82), read-2021 (#82)",read,,,,1,0,False,Descrição não disponível (API 404),"mangas, read-2021","mangas, read-2021|mangas, read-2021"
56677460,"Blue Period, Vol. 5",Tsubasa Yamaguchi,"Yamaguchi, Tsubasa",,1646511271.0,9781646511273.0,5,Kodansha Comics,Paperback,208.0,2021.0,2019.0,2021/02/20,2021/02/18,"mangas, read-2021, favorites","mangas (#59), read-2021 (#23), favorites (#2)",read,,,,1,0,False,Descrição não disponível (API 404),"mangas, read-2021, favorites","mangas, read-2021, favorites|mangas, read-2021, favorites"
50891144,"Jujutsu Kaisen, Vol. 6",Gege Akutami,"Akutami, Gege",,1974714829.0,9781974714827.0,4,VIZ Media LLC,Paperback,192.0,2020.0,2019.0,2020/10/26,2021/01/01,"read-2020, mangas","read-2020 (#84), mangas (#33)",read,,,,2,0,False,Descrição não disponível (API 404),"read-2020, mangas","read-2020, mangas|read-2020, mangas"
52757943,"Jujutsu Kaisen, Vol. 5",Gege Akutami,"Akutami, Gege",,1974714810.0,9781974714810.0,4,VIZ Media LLC,Paperback,192.0,2020.0,2019.0,2020/10/26,2021/01/01,"read-2020, mangas","read-2020 (#83), mangas (#32)",read,,,,2,0,False,Descrição não disponível (API 404),"read-2020, mangas","read-2020, mangas|read-2020, mangas"
52757957,"Jujutsu Kaisen, Vol. 4",Gege Akutami,"Akutami, Gege",,1974714802.0,9781974714803.0,5,VIZ Media LLC,Paperback,200.0,2020.0,2019.0,2021/06/22,2021/01/01,"read-2020, mangas","read-2020 (#82), mangas (#31)",read,,,,2,0,False,Descrição não disponível (API 404),"read-2020, mangas","read-2020, mangas|read-2020, mangas"
52084165,"Jujutsu Kaisen, Vol. 3",Gege Akutami,"Akutami, Gege",Stefan Koza,1974710041.0,9781974710041.0,5,VIZ Media LLC,Paperback,192.0,2020.0,2018.0,2020/10/26,2021/01/01,"read-2020, mangas","read-2020 (#80), mangas (#30)",read,,,,2,0,False,Descrição não disponível (API 404),"read-2020, mangas","read-2020, mangas|read-2020, mangas"
20820994,I'll Give You the Sun,Jandy Nelson,"Nelson, Jandy",,803734964.0,9780803734968.0,4,Dial Books,Hardcover,371.0,2014.0,2014.0,2019/01/01,2019/10/04,,,read,,,,1,0,False,Descrição não disponível (API 404),,|
