Book Id,Title,Author,Author l-f,Additional Authors,ISBN,ISBN13,My Rating,Publisher,Binding,Number of Pages,Year Published,Original Publication Year,Date Read,Date Added,Bookshelves,Bookshelves with positions,Exclusive Shelf,My Review,Spoiler,Private Notes,Read Count,Owned Copies,is_dnf,Description,Genres_Enriched,All_Tags
250019452,とんがり帽子のアトリエ 16 [Tongari Bōshi no Atelier 16],Kamome Shirahama,"Shirahama, Kamome",,4065431522.0,9784065431528.0,5,Kodansha,Paperback,176.0,2026.0,2026.0,2026/05/03,2026/05/03,"mangas, read-2026","mangas (#165), read-2026 (#31)",read,,,,1,0,False,Descrição não disponível (API 404),"mangas, read-2026","mangas, read-2026|mangas, read-2026"
249467594,Witch Hat Atelier 15,Kamome Shirahama,"Shirahama, Kamome",,,9798888779781.0,5,Kodansha Comics,Paperback,,2026.0,2025.0,2026/05/03,2026/05/03,,,read,,,,1,0,False,"A beautifully-illustrated story about a girl who longs for magic in her life and learns that, on the inside, she already is what she wishes she could be. This lushly-drawn story has won an Eisner Award and a Harvey Award, and was voted one of the top 10 manga of the year in 2018 by the Japanese manga industry. BRING ON THE LEECHES At long last, Dagda and Custas are back together, reunited in the medical tower. All they should have to do now is wait for the doctors to treat them. But at that moment, Qifrey has a terrible premonition. Meanwhile, Coco has a plan to defend the town from the rampaging valance leeches. But it's a long shot that'll need all the town's witches to work together...",Comics & Graphic Novels,|Comics & Graphic Novels
236773505,"Witch Hat Atelier, Vol. 14",Kamome Shirahama,"Shirahama, Kamome",,,9798888776858.0,5,Kodansha Comics,Paperback,176.0,2026.0,2025.0,2026/05/03,2026/05/03,"mangas, read-2026","mangas (#164), read-2026 (#30)",read,,,,1,0,False,Descrição não disponível (API 404),"mangas, read-2026","mangas, read-2026|mangas, read-2026"
211401518,"Witch Hat Atelier, Vol. 13",Kamome Shirahama,"Shirahama, Kamome","白浜鴎, Stephen Kohler, Lys Blakeslee, Vanessa Tenazas",,9798888773307.0,5,Kodansha Comics,Paperback,192.0,2025.0,2024.0,2026/05/03,2026/05/03,"mangas, read-2026","mangas (#163), read-2026 (#29)",read,,,,1,0,False,Descrição não disponível (API 404),"mangas, read-2026","mangas, read-2026|mangas, read-2026"
197522392,"Witch Hat Atelier, Vol. 12",Kamome Shirahama,"Shirahama, Kamome","白浜鴎, Stephen Kohler, Lys Blakeslee, Haruko Hashimoto, Alanna Ruse, Angela Zurlo, Phil Balsman",,9798888770795.0,5,Kodansha Comics,Paperback,192.0,2024.0,2023.0,2026/05/03,2026/05/03,"mangas, read-2026","mangas (#162), read-2026 (#28)",read,,,,1,0,False,Descrição não disponível (API 404),"mangas, read-2026","mangas, read-2026|mangas, read-2026"
62672577,"Witch Hat Atelier, Vol. 11",Kamome Shirahama,"Shirahama, Kamome","白浜鴎, Stephen Kohler, Lys Blakeslee, Haruko Hashimoto, Phil Balsman",1646517458.0,9781646517459.0,5,Kodansha Comics,Paperback,160.0,2023.0,2022.0,2026/05/03,2026/05/03,"mangas, read-2026","mangas (#161), read-2026 (#27)",read,,,,1,0,False,Descrição não disponível (API 404),"mangas, read-2026","mangas, read-2026|mangas, read-2026"
60914201,"Witch Hat Atelier, Vol. 10",Kamome Shirahama,"Shirahama, Kamome","白浜鴎, Stephen Kohler, Lys Blakeslee, Phil Balsman, Haruko Hashimoto",1646516184.0,9781646516186.0,4,Kodansha Comics ,Paperback,156.0,2022.0,2022.0,2026/05/03,2026/05/03,"mangas, read-2026","mangas (#160), read-2026 (#26)",read,,,,1,0,False,Descrição não disponível (API 404),"mangas, read-2026","mangas, read-2026|mangas, read-2026"
59082282,"Witch Hat Atelier, Vol. 9",Kamome Shirahama,"Shirahama, Kamome",Stephen Kohler,1646514475.0,9781646514472.0,4,Kodansha Comics,Paperback,174.0,2022.0,2021.0,2026/05/02,2026/05/01,"mangas, read-2026","mangas (#159), read-2026 (#25)",read,,,,1,0,False,Descrição não disponível (API 404),"mangas, read-2026","mangas, read-2026|mangas, read-2026"
56770286,"Witch Hat Atelier, Vol. 8",Kamome Shirahama,"Shirahama, Kamome","白浜鴎, Stephen Kohler, Lys Blakeslee, Haruko Hashimoto, Phil Balsman",1646512693.0,9781646512690.0,4,Kodansha Comics,Paperback,154.0,2021.0,2020.0,2026/04/29,2026/04/24,mangas,mangas (#158),read,,,,1,0,False,Descrição não disponível (API 404),mangas,mangas|mangas
231126909,How to Fake It in Society,K.J. Charles,"Charles, K.J.",,1250395917.0,9781250395917.0,4,Bramble,Paperback,320.0,2026.0,2026.0,2026/04/30,2026/04/11,"coming-2026, romance, read-2026","coming-2026 (#11), romance (#100), read-2026 (#24)",read,,,,1,0,False,Descrição não disponível (API 404),"coming-2026, romance, read-2026","coming-2026, romance, read-2026|coming-2026, romance, read-2026"
53130454,"Witch Hat Atelier, Vol. 7",Kamome Shirahama,"Shirahama, Kamome","白浜鴎, Stephen Kohler, Lys Blakeslee, Haruko Hashimoto, Phil Balsman",164651078.0,9781646510788.0,4,Kodansha Comics,Paperback,170.0,2021.0,2020.0,2026/04/24,2026/04/24,"mangas, read-2026","mangas (#157), read-2026 (#23)",read,,,,1,0,False,Descrição não disponível (API 404),"mangas, read-2026","mangas, read-2026|mangas, read-2026"
54112688,Witch Hat Atelier Vol. 6,Kamome Shirahama,"Shirahama, Kamome",,1646595750.0,9781646595754.0,4,Kodansha Comics,Kindle Edition,178.0,2020.0,2019.0,2026/04/24,2026/04/24,"mangas, read-2026","mangas (#156), read-2026 (#22)",read,,,,1,0,False,Descrição não disponível (API 404),"mangas, read-2026","mangas, read-2026|mangas, read-2026"
49497694,"Witch Hat Atelier, Vol. 5",Kamome Shirahama,"Shirahama, Kamome","白浜鴎, Stephen Kohler, Lys Blakeslee, Ajani Oloye, Jacob Friedman",163236929.0,9781632369291.0,4,Kodansha Comics,Paperback,188.0,2020.0,2019.0,2026/04/24,2026/04/24,"mangas, read-2026","mangas (#155), read-2026 (#21)",read,,,,1,0,False,Descrição não disponível (API 404),"mangas, read-2026","mangas, read-2026|mangas, read-2026"
44784784,"Witch Hat Atelier, Vol. 4",Kamome Shirahama,"Shirahama, Kamome","白浜鴎, Stephen Kohler, Lys Blakeslee, Ajani Oloye",1632368609.0,9781632368607.0,4,Kodansha Comics,Paperback,188.0,2019.0,2018.0,2026/04/24,2026/04/24,"mangas, read-2026","mangas (#154), read-2026 (#20)",read,,,,1,0,False,Descrição não disponível (API 404),"mangas, read-2026","mangas, read-2026|mangas, read-2026"
43312297,"Witch Hat Atelier, Vol. 3",Kamome Shirahama,"Shirahama, Kamome",,1632368056.0,9781632368058.0,4,Kodansha Comics,Paperback,190.0,2019.0,2018.0,2026/04/24,2026/04/23,"mangas, read-2026","mangas (#153), read-2026 (#19)",read,,,,1,0,False,Descrição não disponível (API 404),"mangas, read-2026","mangas, read-2026|mangas, read-2026"
42264867,"Witch Hat Atelier, Vol. 2",Kamome Shirahama,"Shirahama, Kamome",Stephen Kohler,1632368048.0,9781632368041.0,4,Kodansha Comics,Paperback,190.0,2019.0,2017.0,2026/04/23,2026/04/23,"mangas, read-2026","mangas (#152), read-2026 (#18)",read,,,,1,0,False,Descrição não disponível (API 404),"mangas, read-2026","mangas, read-2026|mangas, read-2026"
40893782,"Witch Hat Atelier, Vol. 1",Kamome Shirahama,"Shirahama, Kamome",Stephen Kohler,163236770.0,9781632367709.0,4,Kodansha Comics,Paperback,204.0,2019.0,2017.0,2026/04/23,2022/04/20,"mangas, read-2026","mangas (#112), read-2026 (#17)",read,,,,1,0,False,Descrição não disponível (API 404),"mangas, read-2026","mangas, read-2026|mangas, read-2026"
217247918,"Ultimate X-Men, Vol. 2: Children of the Atom",Peach Momoko,"Momoko, Peach","Zack Davisson, Travis Lanham",130295833.0,9781302958336.0,4,Marvel,Paperback,144.0,2025.0,2025.0,2026/04/22,2026/04/22,"comics, read-2026","comics (#102), read-2026 (#16)",read,,,,1,0,False,Descrição não disponível (API 404),"comics, read-2026","comics, read-2026|comics, read-2026"
20744034,A cabeça do santo,Socorro Acioli,"Acioli, Socorro",,8535923691.0,9788535923698.0,5,Companhia das Letras,Paperback,168.0,2014.0,2014.0,2026/04/21,2026/02/27,read-2026,read-2026 (#15),read,,,,1,0,False,Descrição não disponível (API 404),read-2026,read-2026|read-2026
204642455,"Ultimate X-Men, Vol. 1: Fears and Hates",Peach Momoko,"Momoko, Peach","Zack Davisson, Travis Lanham",1302957317.0,9781302957315.0,4,Marvel,Paperback,160.0,2024.0,2024.0,2026/04/21,2026/04/21,"comics, read-2026","comics (#101), read-2026 (#14)",read,,,,1,0,False,Descrição não disponível (API 404),"comics, read-2026","comics, read-2026|comics, read-2026"
8701864,"Gotham Central, Book Four: Corrigan",Greg Rucka,"Rucka, Greg","Ed Brubaker, Kano",1401230032.0,9781401230036.0,5,DC Comics,Hardcover,224.0,2011.0,2011.0,2026/04/13,2026/04/08,"comics, read-2026","comics (#100), read-2026 (#12)",read,,,,1,0,False,Descrição não disponível (API 404),"comics, read-2026","comics, read-2026|comics, read-2026"
231680079,The Poet Empress,Shen Tao,"Tao, Shen",,125040682.0,9781250406828.0,5,Bramble,Kindle Edition,432.0,2026.0,2026.0,2026/04/10,2026/04/07,"coming-2026, read-2026","coming-2026 (#9), read-2026 (#13)",read,"eu amei esse livro!! o sistema de magia é muito interessante, a protagonista, wei, é maravilhosa e eu amei seguir a narrativa dela. <br/><br/>a autora consegue, de alguma forma, contar uma história dentro da história, assim os leitores seguem ao mesmo tempo os desdobramentos da vida da wei no palácio e descobrem os segredos do noivo terrível dela, que podem ser sua única chance de sobrevivência. <br/><br/>a atmosfera da história é envolvente e a construção de mundo é bem trabalhada, eu fui muito surpreendida pelas reviravoltas da história e eu amo isso. fazia muito tempo que eu não lia fantasia e esse livro me lembrou porque eu amo esse gênero literário.",,,1,0,False,Descrição não disponível (API 404),"coming-2026, read-2026","coming-2026, read-2026|coming-2026, read-2026"
52238002,"Subtle Blood (The Will Darling Adventures, #3)",K.J. Charles,"Charles, K.J.",,,9781912688197.0,5,KJC Books,ebook,290.0,2021.0,2021.0,2021/09/25,2021/09/25,"romance, read-2021, favorites","romance (#9), read-2021 (#105), favorites (#14)",read,"honestly, i could reread this series a hundred times! these are my comfort books and the only bad thing about them is that they end.",,,4,0,False,Descrição não disponível (API 404),"romance, read-2021, favorites","romance, read-2021, favorites|romance, read-2021, favorites"
52237997,"The Sugared Game (The Will Darling Adventures, #2)",K.J. Charles,"Charles, K.J.",,1912688174.0,9781912688173.0,5,KJC Books,Kindle Edition,288.0,2020.0,2020.0,2021/09/25,2021/09/24,"romance, read-2021, favorites","romance (#8), read-2021 (#104), favorites (#13)",read,,,,4,0,False,Descrição não disponível (API 404),"romance, read-2021, favorites","romance, read-2021, favorites|romance, read-2021, favorites"
52237989,"Slippery Creatures (The Will Darling Adventures, #1)",K.J. Charles,"Charles, K.J.",,1912688158.0,9781912688159.0,5,KJC Books,ebook,265.0,2020.0,2020.0,2021/09/24,2021/08/19,"romance, read-2021, favorites","romance (#6), read-2021 (#103), favorites (#12)",read,gay people doing espionage in the 1920s is everything i didn’t know i needed!! will darling is a great main character and it was so much fun to go along with his adventures when he was literally just trying to chill. i also love his friendship with maisie and phoebe and the romance with kim.,,,4,0,False,Descrição não disponível (API 404),"romance, read-2021, favorites","romance, read-2021, favorites|romance, read-2021, favorites"
45165750,The Memory Police,Yōko Ogawa,"Ogawa, Yōko","Stephen    Snyder, Traci Kato-Kiriyama",525634274.0,9780525634270.0,4,Random House Audio,Audiobook,7.0,2019.0,1994.0,2025/07/08,2025/02/03,read-2025,read-2025 (#18),read,"read/listened to the audiobook.<br/>the audiobook brings so much to the story, the narrator did such an amazing job at creating a spooky and unnerving atmosphere. the story itself, as long as it took for me to finish, is captivating and heartbreaking, the ending was unexpected but also the only one that could exist.<br/>i didn't think forgetting was so scary, but this book, which is as much about memories making you who you are as it is about fascism, really makes you feel as desperate as the characters. i loved it!",,,1,0,False,Descrição não disponível (API 404),read-2025,read-2025|read-2025
106069,Batman: The Long Halloween,Jeph Loeb,"Loeb, Jeph",Tim Sale,1563894696.0,9781563894695.0,5,DC Comics,Paperback,376.0,1999.0,1997.0,2022/04/02,2022/03/26,"comics, read-2022, favorites","comics (#33), read-2022 (#35), favorites (#11)",read,,,,2,0,False,Descrição não disponível (API 404),"comics, read-2022, favorites","comics, read-2022, favorites|comics, read-2022, favorites"
7113260,"Gotham Central, Book Three: On the Freak Beat",Ed Brubaker,"Brubaker, Ed","Michael Lark, Stefano Gaudiano",1401227546.0,9781401227548.0,5,DC Comics,Hardcover,224.0,2010.0,2010.0,2026/04/08,2026/04/07,"comics, read-2026","comics (#99), read-2026 (#11)",read,,,,1,0,False,Descrição não disponível (API 404),"comics, read-2026","comics, read-2026|comics, read-2026"
6375833,"Gotham Central, Book Two: Jokers and Madmen",Ed Brubaker,"Brubaker, Ed","Greg Rucka, Michael Lark, Greg Scott, Brian Hurtt, Stefano Gaudiano",1401225217.0,9781401225216.0,4,DC Comics,Hardcover,288.0,2009.0,2005.0,2026/04/07,2026/03/21,"comics, read-2026","comics (#98), read-2026 (#9)",read,,,,1,0,False,Descrição não disponível (API 404),"comics, read-2026","comics, read-2026|comics, read-2026"
3316474,"Gotham Central, Book One: In the Line of Duty",Ed Brubaker,"Brubaker, Ed","Greg Rucka, Michael Lark, Lawrence Block, Kano",1401219233.0,9781401219239.0,4,DC Comics,Hardcover,240.0,2008.0,2003.0,2026/03/21,2024/01/03,"comics, read-2026","comics (#43), read-2026 (#8)",read,,,,1,0,False,Descrição não disponível (API 404),"comics, read-2026","comics, read-2026|comics, read-2026"
216970870,Serial Killer Games,Kate  Posey,"Posey, Kate",,593818512.0,9780593818510.0,4,Berkley,Paperback,384.0,2025.0,2025.0,2026/03/09,2025/09/21,"romance, read-2026","romance (#94), read-2026 (#7)",read,"esse livro me enganou tantas vezes, eu amei! os personagens são muito interessantes e engraçados! o romance é fofo demais e o enredo foi o que mais me prendeu, impossível não ser surpreendida por essa história.",,,1,0,False,Descrição não disponível (API 404),"romance, read-2026","romance, read-2026|romance, read-2026"
30144474,"Batgirl, Vol. 3: Point Blank",Kelley Puckett,"Puckett, Kelley",Various,1401265855.0,9781401265854.0,4,DC Comics,Paperback,288.0,2017.0,2003.0,2026/02/22,2026/02/15,comics,comics (#96),read,,,,1,0,False,Descrição não disponível (API 404),comics,comics|comics
27405513,"Batgirl, Vol. 2: To the Death",Kelley Puckett,"Puckett, Kelley",Various,1401263526.0,9781401263522.0,4,DC Comics,Paperback,320.0,2016.0,2002.0,2026/02/21,2026/02/15,comics,comics (#95),read,,,,1,0,False,Descrição não disponível (API 404),comics,comics|comics
25810117,"Batgirl, Vol. 1: Silent Knight",Kelley Puckett,"Puckett, Kelley","Scott E.  Peterson, Damion Scott, Chuck Dixon, Koi Turnbull, Dale Eaglesham, Mike Deodato, Robert Campanella, Pablo Raimondi",1401260721.0,9781401260729.0,4,DC Comics,Paperback,328.0,2001.0,2001.0,2026/02/20,2026/02/15,"comics, read-2026","comics (#97), read-2026 (#3)",read,"te amo cassandra cain!!! tem tantas histórias lindas, a arte deixa a desejar em alguns momentos (efeito dos anos 2000), mas é bonita! a relação da cass e da barbara é uma das minhas partes preferidas",,,1,0,False,Descrição não disponível (API 404),"comics, read-2026","comics, read-2026|comics, read-2026"
24507092,To Hell and Back: The Last Train from Hiroshima (Asia/Pacific/Perspectives),Charles Pellegrino,"Pellegrino, Charles",,1442250585.0,9781442250581.0,5,Rowman & Littlefield Publishers,Hardcover,432.0,2015.0,2010.0,2026/02/26,2026/02/23,nonfiction,nonfiction (#18),read,"muito bem escrito, partiu meu coração! é aterrorizante pensar que algo assim já aconteceu e pode acontecer de novo. esse livro me fez pensar muito, acho que todos deveriam ler, apesar de ser tão pesado.",,,1,0,False,Descrição não disponível (API 404),nonfiction,nonfiction|nonfiction
61049,Autobiography of Red,Anne Carson,"Carson, Anne",Stesichorus,37570129.0,9780375701290.0,5,Vintage Books,Paperback,160.0,1999.0,1998.0,2026/02/22,2024/09/16,read-2026,read-2026 (#6),read,"eu amei, é muito emocionante e surpreendente! o tipo de livro que você relê mil vezes e descobre coisas novas. ",,,1,0,False,Descrição não disponível (API 404),read-2026,read-2026|read-2026
18691062,"Batman: Bruce Wayne, Fugitive",Greg Rucka,"Rucka, Greg","Ed Brubaker, Devin Grayson, Chuck Dixon, Kelley Puckett, Rick Leonardi, Michael Golden, Brian Bolland, Trevor McCarthy, Damion Scott, Scott McDaniel, Dave Ross, William Rosado, Roger Robinson, Sean Phillips, Phil Noto, Steve Leiber, Sergio Cariello, Dennis O'Neil, Geoff Johns",1401246826.0,9781401246822.0,4,DC Comics,Paperback,418.0,2014.0,2002.0,2026/02/15,2024/03/31,"comics, read-2026","comics (#52), read-2026 (#5)",read,"é um final muito digno para esse arco, eu simplesmente amei a exploração do personagem do batman e das suas relações com as pessoas na vida dele. pra mim, as melhores histórias são as que não tem medo de fazer isso, de reconhecer os defeitos dele sem perder de vista quem ele é. e eu defenderia a cassandra cain com a minha vida!!",,,1,0,False,Descrição não disponível (API 404),"comics, read-2026","comics, read-2026|comics, read-2026"
106059,"Batman: Bruce Wayne, Murderer?",Greg Rucka,"Rucka, Greg","Chuck Dixon, Steve Lieber, Jesse Delperdang, Trevor McCarthy, Scott McDaniel, Roger Robinson, Damion Scott, Pete Woods, Ed Brubaker, Devin Grayson, Kelley Puckett, Rick Burchett, Rick Leonardi",1563899132.0,9781563899133.0,4,DC Comics,Paperback,552.0,2002.0,2002.0,2026/02/13,2024/03/31,read-2026,read-2026 (#4),read,"maravilhosa, gosto muito das histórias do universo do batman dos anos 2000. tem tudo que eu gosto nas hqs do batman: um mistério muito envolvente, os personagens incríveis, uma arte linda e a atmosfera de gotham que eu amo tanto. estou muito ansiosa pra ler o desfecho dessa história!",,,1,0,False,Descrição não disponível (API 404),read-2026,read-2026|read-2026
247292749,"My Dear Detective: Mitsuko’s Case Files, Vol. 7",Natsumi Ito,"Ito, Natsumi",Arthur Miura,1960186310.0,9781960186317.0,5,Omoi,Kindle Edition,,2026.0,,2026/02/04,2026/02/04,"mangas, read-2026","mangas (#151), read-2026 (#2)",read,"eu amo essa história tanto, mitsuki e saku são tão especiais!!!",,,1,0,False,Descrição não disponível (API 404),"mangas, read-2026","mangas, read-2026|mangas, read-2026"
43352954,This Is How You Lose the Time War,Amal El-Mohtar,"El-Mohtar, Amal",Max Gladstone,,,5,Saga Press,ebook,209.0,2019.0,2019.0,2020/01/02,2020/12/15,read-2020,read-2020 (#1),read,,,,2,0,False,Descrição não disponível (API 404),read-2020,read-2020|read-2020
204642474,Catwoman: Trail of the Catwoman,Ed Brubaker,"Brubaker, Ed",Darwyn Cooke,1779527284.0,9781779527288.0,4,DC Comics,Paperback,336.0,2024.0,2008.0,2026/01/16,2026/01/11,read-2026,read-2026 (#1),read,"muito bom! a selina é uma personagem que apaixona rapidamente pelo seu jeito sarcástico, forte e inteligente e todos os outros personagens também são muito distintos e interessantes.<br/>o enredo não deixa a desejar, é uma história muito envolvente sobre corrupção e as pessoas que são esquecidas e ignoradas pela sociedade, eu achei a mulher-gato uma grande justiceira, amei a jornada dela.<br/>minha única crítica é que o último arco nos deixa querendo mais, mas como introdução da personagem imagino que é essa a intenção. ",,,1,0,False,Descrição não disponível (API 404),read-2026,read-2026|read-2026
218689177,Great Big Beautiful Life,Emily Henry,"Henry, Emily",Julia  Whelan,,,4,Penguin Audio,Audiobook,12.0,2025.0,2025.0,2025/12/06,2024/10/16,"romance, read-2025","romance (#84), read-2025 (#45)",read,"what a beautiful book! definitely one of my favorites among emily henry’s books. after happy place and funny story i thought maybe i wouldn’t be into it anymore, but this book!!! this book!! the story is so interesting, the characters are fleshed out and you can’t stop rooting for them. the audiobook experience is flawless <3",,,1,0,False,Descrição não disponível (API 404),"romance, read-2025","romance, read-2025|romance, read-2025"
60811826,I Who Have Never Known Men,Jacqueline Harpman,"Harpman, Jacqueline","Ros Schwartz, Sophie Mackintosh",1945492600.0,9781945492600.0,4,Transit Books,Paperback,173.0,2022.0,1995.0,2025/01/26,2025/01/26,read-2025,read-2025 (#3),read,"once when i was a child i was running down a corridor and fell face down, all the air vanished from my body and i had to stay still for a couple of minutes until i could breathe again. i who have never know men feels like that experience. <br/><br/>the book is very direct and sometimes even a bit funny in its absurdity, but also quietly sad. it’s weirdly hopeful, despite the fact that all hope is lost! it’s unlike anything i can remember reading before and i really loved it.",,,1,0,False,Descrição não disponível (API 404),read-2025,read-2025|read-2025
39325105,"Harrow the Ninth (The Locked Tomb, #2)",Tamsyn Muir,"Muir, Tamsyn",,1250313228.0,9781250313225.0,5,Tor.com,Hardcover,512.0,2020.0,2020.0,2023/06/15,2023/05/26,read-2023,read-2023 (#13),read,,,,2,0,False,Descrição não disponível (API 404),read-2023,read-2023|read-2023
42036538,"Gideon the Ninth (The Locked Tomb, #1)",Tamsyn Muir,"Muir, Tamsyn",,1250313198.0,9781250313195.0,5,Tor,Hardcover,448.0,2019.0,2019.0,2023/05/26,2022/01/30,"read-2023, favorites","read-2023 (#12), favorites (#8)",read,,,,2,0,False,Descrição não disponível (API 404),"read-2023, favorites","read-2023, favorites|read-2023, favorites"
242387852,SAKAMOTO DAYS 24,Yuto Suzuki,"Suzuki, Yuto",鈴木祐斗,4088846923.0,9784088846927.0,4,集英社,Paperback,184.0,2025.0,2025.0,2025/10/14,2025/10/14,"mangas, read-2025","mangas (#150), read-2025 (#44)",read,,,,1,0,False,Descrição não disponível (API 404),"mangas, read-2025","mangas, read-2025|mangas, read-2025"
239941434,SAKAMOTO DAYS 23,Yuto Suzuki,"Suzuki, Yuto",鈴木祐斗,4088846087.0,9784088846088.0,4,集英社,Paperback,184.0,2025.0,2025.0,2025/10/14,2025/10/12,"mangas, read-2025","mangas (#149), read-2025 (#43)",read,,,,1,0,False,Descrição não disponível (API 404),"mangas, read-2025","mangas, read-2025|mangas, read-2025"
232522344,SAKAMOTO DAYS 22,Yuto Suzuki,"Suzuki, Yuto",鈴木祐斗,4088845544.0,9784088845548.0,4,集英社,Paperback,192.0,2025.0,2025.0,2025/10/12,2025/10/12,"mangas, read-2025","mangas (#148), read-2025 (#42)",read,,,,1,0,False,Descrição não disponível (API 404),"mangas, read-2025","mangas, read-2025|mangas, read-2025"
235992115,"Sakamoto Days, Vol. 21",Yuto Suzuki,"Suzuki, Yuto",,1974762319.0,9781974762316.0,4,VIZ Media LLC,Paperback,200.0,2026.0,2025.0,2025/10/12,2025/10/12,"mangas, read-2025","mangas (#147), read-2025 (#41)",read,,,,1,0,False,Descrição não disponível (API 404),"mangas, read-2025","mangas, read-2025|mangas, read-2025"
235992189,"Sakamoto Days, Vol. 20",Yuto Suzuki,"Suzuki, Yuto",,1974762300.0,9781974762309.0,4,VIZ Media LLC,Paperback,200.0,2026.0,2025.0,2025/10/12,2025/10/12,"mangas, read-2025","mangas (#146), read-2025 (#40)",read,,,,1,0,False,Descrição não disponível (API 404),"mangas, read-2025","mangas, read-2025|mangas, read-2025"
224004536,"Sakamoto Days, Vol. 19",Yuto Suzuki,"Suzuki, Yuto",,1974759008.0,9781974759002.0,4,VIZ Media LLC,Paperback,192.0,2025.0,2024.0,2025/10/12,2025/10/12,"mangas, read-2025","mangas (#145), read-2025 (#39)",read,,,,1,0,False,Descrição não disponível (API 404),"mangas, read-2025","mangas, read-2025|mangas, read-2025"
220161050,"Sakamoto Days, Vol. 18",Yuto Suzuki,"Suzuki, Yuto",,1974755940.0,9781974755943.0,4,VIZ Media LLC,Paperback,200.0,2025.0,2024.0,2025/10/12,2025/10/12,"mangas, read-2025","mangas (#144), read-2025 (#38)",read,,,,1,0,False,Descrição não disponível (API 404),"mangas, read-2025","mangas, read-2025|mangas, read-2025"
220161117,"Sakamoto Days, Vol. 17",Yuto Suzuki,"Suzuki, Yuto",,1974755878.0,9781974755875.0,4,VIZ Media LLC,Paperback,184.0,2025.0,2024.0,2025/10/12,2025/10/12,"mangas, read-2025","mangas (#143), read-2025 (#37)",read,,,,1,0,False,Descrição não disponível (API 404),"mangas, read-2025","mangas, read-2025|mangas, read-2025"
214151474,"Sakamoto Days, Vol. 16",Yuto Suzuki,"Suzuki, Yuto",,1974752763.0,9781974752768.0,4,VIZ Media LLC,Paperback,192.0,2025.0,2024.0,2025/10/12,2025/10/11,"mangas, read-2025","mangas (#142), read-2025 (#36)",read,,,,1,0,False,Descrição não disponível (API 404),"mangas, read-2025","mangas, read-2025|mangas, read-2025"
214151605,"Sakamoto Days, Vol. 15",Yuto Suzuki,"Suzuki, Yuto",,1974751694.0,9781974751693.0,4,VIZ Media LLC,Paperback,192.0,2025.0,2024.0,2025/10/11,2025/10/11,"mangas, read-2025","mangas (#141), read-2025 (#35)",read,,,,1,0,False,Descrição não disponível (API 404),"mangas, read-2025","mangas, read-2025|mangas, read-2025"
207297944,"Sakamoto Days, Vol. 14",Yuto Suzuki,"Suzuki, Yuto",,1974749789.0,9781974749782.0,4,VIZ Media LLC,Paperback,192.0,2024.0,2023.0,2025/10/11,2025/10/11,"mangas, read-2025","mangas (#140), read-2025 (#34)",read,,,,1,0,False,Descrição não disponível (API 404),"mangas, read-2025","mangas, read-2025|mangas, read-2025"
207297606,"Sakamoto Days, Vol. 13",Yuto Suzuki,"Suzuki, Yuto",,197474888.0,9781974748884.0,4,VIZ Media LLC,Paperback,192.0,2024.0,2023.0,2025/10/11,2025/10/11,"mangas, read-2025","mangas (#139), read-2025 (#33)",read,,,,1,0,False,Descrição não disponível (API 404),"mangas, read-2025","mangas, read-2025|mangas, read-2025"
