Book Id,Title,Author,Author l-f,Additional Authors,ISBN,ISBN13,My Rating,Publisher,Binding,Number of Pages,Year Published,Original Publication Year,Date Read,Date Added,Bookshelves,Bookshelves with positions,Exclusive Shelf,My Review,Spoiler,Private Notes,Read Count,Owned Copies
53014635,Se Deus me Chamar Não Vou,Mariana Salomão Carrara,"Carrara, Mariana Salomão",,"=""8569020457""","=""9788569020455""",0,Nós,Paperback,160,2019,2019,,2026/05/04,to-read,to-read (#183),to-read,,,,0,0
34701167,White Chrysanthemum,Mary Lynn Bracht,"Bracht, Mary Lynn",,"=""052549765X""","=""9780525497653""",0,G.P. Putnam's Sons,Hardcover,320,2018,2018,,2026/05/04,to-read,to-read (#182),to-read,,,,0,0
250019452,とんがり帽子のアトリエ 16 [Tongari Bōshi no Atelier 16],Kamome Shirahama,"Shirahama, Kamome",,"=""4065431522""","=""9784065431528""",5,Kodansha,Paperback,176,2026,2026,2026/05/03,2026/05/03,"mangas, read-2026","mangas (#165), read-2026 (#31)",read,,,,1,0
249467594,Witch Hat Atelier 15,Kamome Shirahama,"Shirahama, Kamome",,"=""""","=""9798888779781""",5,Kodansha Comics,Paperback,,2026,2025,2026/05/03,2026/05/03,,,read,,,,1,0
236773505,"Witch Hat Atelier, Vol. 14",Kamome Shirahama,"Shirahama, Kamome",,"=""""","=""9798888776858""",5,Kodansha Comics,Paperback,176,2026,2025,2026/05/03,2026/05/03,"mangas, read-2026","mangas (#164), read-2026 (#30)",read,,,,1,0
211401518,"Witch Hat Atelier, Vol. 13",Kamome Shirahama,"Shirahama, Kamome","白浜鴎, Stephen Kohler, Lys Blakeslee, Vanessa Tenazas","=""""","=""9798888773307""",5,Kodansha Comics,Paperback,192,2025,2024,2026/05/03,2026/05/03,"mangas, read-2026","mangas (#163), read-2026 (#29)",read,,,,1,0
197522392,"Witch Hat Atelier, Vol. 12",Kamome Shirahama,"Shirahama, Kamome","白浜鴎, Stephen Kohler, Lys Blakeslee, Haruko Hashimoto, Alanna Ruse, Angela Zurlo, Phil Balsman","=""""","=""9798888770795""",5,Kodansha Comics,Paperback,192,2024,2023,2026/05/03,2026/05/03,"mangas, read-2026","mangas (#162), read-2026 (#28)",read,,,,1,0
62672577,"Witch Hat Atelier, Vol. 11",Kamome Shirahama,"Shirahama, Kamome","白浜鴎, Stephen Kohler, Lys Blakeslee, Haruko Hashimoto, Phil Balsman","=""1646517458""","=""9781646517459""",5,Kodansha Comics,Paperback,160,2023,2022,2026/05/03,2026/05/03,"mangas, read-2026","mangas (#161), read-2026 (#27)",read,,,,1,0
60914201,"Witch Hat Atelier, Vol. 10",Kamome Shirahama,"Shirahama, Kamome","白浜鴎, Stephen Kohler, Lys Blakeslee, Phil Balsman, Haruko Hashimoto","=""1646516184""","=""9781646516186""",4,Kodansha Comics ,Paperback,156,2022,2022,2026/05/03,2026/05/03,"mangas, read-2026","mangas (#160), read-2026 (#26)",read,,,,1,0
59082282,"Witch Hat Atelier, Vol. 9",Kamome Shirahama,"Shirahama, Kamome",Stephen Kohler,"=""1646514475""","=""9781646514472""",4,Kodansha Comics,Paperback,174,2022,2021,2026/05/02,2026/05/01,"mangas, read-2026","mangas (#159), read-2026 (#25)",read,,,,1,0
56770286,"Witch Hat Atelier, Vol. 8",Kamome Shirahama,"Shirahama, Kamome","白浜鴎, Stephen Kohler, Lys Blakeslee, Haruko Hashimoto, Phil Balsman","=""1646512693""","=""9781646512690""",4,Kodansha Comics,Paperback,154,2021,2020,2026/04/29,2026/04/24,mangas,mangas (#158),read,,,,1,0
231126909,How to Fake It in Society,K.J. Charles,"Charles, K.J.",,"=""1250395917""","=""9781250395917""",4,Bramble,Paperback,320,2026,2026,2026/04/30,2026/04/11,"coming-2026, romance, read-2026","coming-2026 (#11), romance (#100), read-2026 (#24)",read,,,,1,0
230025680,"Ultimate X-Men, Vol. 3: The Realm of the Mind",Peach Momoko,"Momoko, Peach","Zach Davisson, Travis Lanham","=""1302958348""","=""9781302958343""",0,Marvel,Paperback,152,2025,2025,,2026/04/22,"comics, to-read","comics (#103), to-read (#181)",to-read,,,,1,0
53130454,"Witch Hat Atelier, Vol. 7",Kamome Shirahama,"Shirahama, Kamome","白浜鴎, Stephen Kohler, Lys Blakeslee, Haruko Hashimoto, Phil Balsman","=""164651078X""","=""9781646510788""",4,Kodansha Comics,Paperback,170,2021,2020,2026/04/24,2026/04/24,"mangas, read-2026","mangas (#157), read-2026 (#23)",read,,,,1,0
54112688,Witch Hat Atelier Vol. 6,Kamome Shirahama,"Shirahama, Kamome",,"=""1646595750""","=""9781646595754""",4,Kodansha Comics,Kindle Edition,178,2020,2019,2026/04/24,2026/04/24,"mangas, read-2026","mangas (#156), read-2026 (#22)",read,,,,1,0
49497694,"Witch Hat Atelier, Vol. 5",Kamome Shirahama,"Shirahama, Kamome","白浜鴎, Stephen Kohler, Lys Blakeslee, Ajani Oloye, Jacob Friedman","=""163236929X""","=""9781632369291""",4,Kodansha Comics,Paperback,188,2020,2019,2026/04/24,2026/04/24,"mangas, read-2026","mangas (#155), read-2026 (#21)",read,,,,1,0
44784784,"Witch Hat Atelier, Vol. 4",Kamome Shirahama,"Shirahama, Kamome","白浜鴎, Stephen Kohler, Lys Blakeslee, Ajani Oloye","=""1632368609""","=""9781632368607""",4,Kodansha Comics,Paperback,188,2019,2018,2026/04/24,2026/04/24,"mangas, read-2026","mangas (#154), read-2026 (#20)",read,,,,1,0
43312297,"Witch Hat Atelier, Vol. 3",Kamome Shirahama,"Shirahama, Kamome",,"=""1632368056""","=""9781632368058""",4,Kodansha Comics,Paperback,190,2019,2018,2026/04/24,2026/04/23,"mangas, read-2026","mangas (#153), read-2026 (#19)",read,,,,1,0
42264867,"Witch Hat Atelier, Vol. 2",Kamome Shirahama,"Shirahama, Kamome",Stephen Kohler,"=""1632368048""","=""9781632368041""",4,Kodansha Comics,Paperback,190,2019,2017,2026/04/23,2026/04/23,"mangas, read-2026","mangas (#152), read-2026 (#18)",read,,,,1,0
40893782,"Witch Hat Atelier, Vol. 1",Kamome Shirahama,"Shirahama, Kamome",Stephen Kohler,"=""163236770X""","=""9781632367709""",4,Kodansha Comics,Paperback,204,2019,2017,2026/04/23,2022/04/20,"mangas, read-2026","mangas (#112), read-2026 (#17)",read,,,,1,0
217247918,"Ultimate X-Men, Vol. 2: Children of the Atom",Peach Momoko,"Momoko, Peach","Zack Davisson, Travis Lanham","=""130295833X""","=""9781302958336""",4,Marvel,Paperback,144,2025,2025,2026/04/22,2026/04/22,"comics, read-2026","comics (#102), read-2026 (#16)",read,,,,1,0
20744034,A cabeça do santo,Socorro Acioli,"Acioli, Socorro",,"=""8535923691""","=""9788535923698""",5,Companhia das Letras,Paperback,168,2014,2014,2026/04/21,2026/02/27,read-2026,read-2026 (#15),read,,,,1,0
204642455,"Ultimate X-Men, Vol. 1: Fears and Hates",Peach Momoko,"Momoko, Peach","Zack Davisson, Travis Lanham","=""1302957317""","=""9781302957315""",4,Marvel,Paperback,160,2024,2024,2026/04/21,2026/04/21,"comics, read-2026","comics (#101), read-2026 (#14)",read,,,,1,0
8701864,"Gotham Central, Book Four: Corrigan",Greg Rucka,"Rucka, Greg","Ed Brubaker, Kano","=""1401230032""","=""9781401230036""",5,DC Comics,Hardcover,224,2011,2011,2026/04/13,2026/04/08,"comics, read-2026","comics (#100), read-2026 (#12)",read,,,,1,0
231680079,The Poet Empress,Shen Tao,"Tao, Shen",,"=""125040682X""","=""9781250406828""",5,Bramble,Kindle Edition,432,2026,2026,2026/04/10,2026/04/07,"coming-2026, read-2026","coming-2026 (#9), read-2026 (#13)",read,"eu amei esse livro!! o sistema de magia é muito interessante, a protagonista, wei, é maravilhosa e eu amei seguir a narrativa dela. <br/><br/>a autora consegue, de alguma forma, contar uma história dentro da história, assim os leitores seguem ao mesmo tempo os desdobramentos da vida da wei no palácio e descobrem os segredos do noivo terrível dela, que podem ser sua única chance de sobrevivência. <br/><br/>a atmosfera da história é envolvente e a construção de mundo é bem trabalhada, eu fui muito surpreendida pelas reviravoltas da história e eu amo isso. fazia muito tempo que eu não lia fantasia e esse livro me lembrou porque eu amo esse gênero literário.",,,1,0
39978052,"Fire & Blood: 300 Years Before A Game of Thrones (A Targaryen History, #1)",George R.R. Martin,"Martin, George R.R.",Simon Vance,"=""""","=""""",0,Random House Audio,Audible Audio,27,2018,2018,,2026/03/29,"read-2026, did-not-finish","read-2026 (#10), did-not-finish (#13)",did-not-finish,"[10/04/2026]: stopped at 21%, will come back later (maybe) (probably)",,,1,0
231679954,The Red Winter,Cameron Sullivan,"Sullivan, Cameron",,"=""1250362776""","=""9781250362773""",0,Tor Books,Kindle Edition,529,2026,2026,,2026/04/10,"to-read, coming-2026","to-read (#180), coming-2026 (#10)",to-read,,,,0,0
52238002,"Subtle Blood (The Will Darling Adventures, #3)",K.J. Charles,"Charles, K.J.",,"=""""","=""9781912688197""",5,KJC Books,ebook,290,2021,2021,2021/09/25,2021/09/25,"romance, read-2021, favorites","romance (#9), read-2021 (#105), favorites (#14)",read,"honestly, i could reread this series a hundred times! these are my comfort books and the only bad thing about them is that they end.",,,4,0
52237997,"The Sugared Game (The Will Darling Adventures, #2)",K.J. Charles,"Charles, K.J.",,"=""1912688174""","=""9781912688173""",5,KJC Books,Kindle Edition,288,2020,2020,2021/09/25,2021/09/24,"romance, read-2021, favorites","romance (#8), read-2021 (#104), favorites (#13)",read,,,,4,0
52237989,"Slippery Creatures (The Will Darling Adventures, #1)",K.J. Charles,"Charles, K.J.",,"=""1912688158""","=""9781912688159""",5,KJC Books,ebook,265,2020,2020,2021/09/24,2021/08/19,"romance, read-2021, favorites","romance (#6), read-2021 (#103), favorites (#12)",read,gay people doing espionage in the 1920s is everything i didn’t know i needed!! will darling is a great main character and it was so much fun to go along with his adventures when he was literally just trying to chill. i also love his friendship with maisie and phoebe and the romance with kim.,,,4,0
45165750,The Memory Police,Yōko Ogawa,"Ogawa, Yōko","Stephen    Snyder, Traci Kato-Kiriyama","=""0525634274""","=""9780525634270""",4,Random House Audio,Audiobook,7,2019,1994,2025/07/08,2025/02/03,read-2025,read-2025 (#18),read,"read/listened to the audiobook.<br/>the audiobook brings so much to the story, the narrator did such an amazing job at creating a spooky and unnerving atmosphere. the story itself, as long as it took for me to finish, is captivating and heartbreaking, the ending was unexpected but also the only one that could exist.<br/>i didn't think forgetting was so scary, but this book, which is as much about memories making you who you are as it is about fascism, really makes you feel as desperate as the characters. i loved it!",,,1,0
106069,Batman: The Long Halloween,Jeph Loeb,"Loeb, Jeph",Tim Sale,"=""1563894696""","=""9781563894695""",5,DC Comics,Paperback,376,1999,1997,2022/04/02,2022/03/26,"comics, read-2022, favorites","comics (#33), read-2022 (#35), favorites (#11)",read,,,,2,0
7113260,"Gotham Central, Book Three: On the Freak Beat",Ed Brubaker,"Brubaker, Ed","Michael Lark, Stefano Gaudiano","=""1401227546""","=""9781401227548""",5,DC Comics,Hardcover,224,2010,2010,2026/04/08,2026/04/07,"comics, read-2026","comics (#99), read-2026 (#11)",read,,,,1,0
6763725,Capitalist Realism: Is There No Alternative?,Mark Fisher,"Fisher, Mark",,"=""1846943175""","=""9781846943171""",0,Zero Books,Paperback,81,2009,2009,,2026/04/08,"to-read, nonfiction","to-read (#179), nonfiction (#23)",to-read,,,,0,0
6375833,"Gotham Central, Book Two: Jokers and Madmen",Ed Brubaker,"Brubaker, Ed","Greg Rucka, Michael Lark, Greg Scott, Brian Hurtt, Stefano Gaudiano","=""1401225217""","=""9781401225216""",4,DC Comics,Hardcover,288,2009,2005,2026/04/07,2026/03/21,"comics, read-2026","comics (#98), read-2026 (#9)",read,,,,1,0
227759573,We Breed Lions: Confronting Canada's Troubled Hockey Culture,Rick Westhead,"Westhead, Rick",,"=""1039012949""","=""9781039012943""",0,Random House Canada,Kindle Edition,407,2025,2025,,2025/11/06,"nonfiction, to-read","nonfiction (#15), to-read (#178)",to-read,,,,1,0
216970860,Girl on Girl: How Pop Culture Turned a Generation of Women Against Themselves,Sophie Gilbert,"Gilbert, Sophie",,"=""0593656296""","=""9780593656297""",0,Penguin Press,Hardcover,352,2025,2025,,2026/03/24,"to-read, nonfiction","to-read (#177), nonfiction (#22)",to-read,,,,0,0
3316474,"Gotham Central, Book One: In the Line of Duty",Ed Brubaker,"Brubaker, Ed","Greg Rucka, Michael Lark, Lawrence Block, Kano","=""1401219233""","=""9781401219239""",4,DC Comics,Hardcover,240,2008,2003,2026/03/21,2024/01/03,"comics, read-2026","comics (#43), read-2026 (#8)",read,,,,1,0
184447530,"The Hades Calculus (Gunmetal Olympus, #1)",Maria Ying,"Ying, Maria",,"=""""","=""""",0,Hua Publishing,Kindle Edition,418,2024,2024,,2026/03/16,to-read,to-read (#176),to-read,,,,0,0
216970870,Serial Killer Games,Kate  Posey,"Posey, Kate",,"=""0593818512""","=""9780593818510""",4,Berkley,Paperback,384,2025,2025,2026/03/09,2025/09/21,"romance, read-2026","romance (#94), read-2026 (#7)",read,"esse livro me enganou tantas vezes, eu amei! os personagens são muito interessantes e engraçados! o romance é fofo demais e o enredo foi o que mais me prendeu, impossível não ser surpreendida por essa história.",,,1,0
46261182,"The Awakening (Zodiac Academy, #1)",Caroline Peckham,"Peckham, Caroline",Susanne Valenti,"=""""","=""""",1,Dark Ink Publishing,Kindle Edition,436,2019,2019,,2023/05/26,"did-not-finish, read-2023","did-not-finish (#10), read-2023 (#25)",did-not-finish,"dnf @ 56%<br/><br/>who the fuck called this enemies to lovers?? these male love interests are constantly sexually assaulting these girls and doing horrific things to them. that’s literally the entire plot, nothing else happens at all, and it’s somehow justified because “they should just get strong enough to beat them up if they want it to stop”. this book made me sick, it’s absolute trash and the writing is awful. ",,,1,0
212808316,"Wings of Starlight (Wings of Pixie Hollow, #1)",Allison Saft,"Saft, Allison",,"=""1368098452""","=""9781368098458""",0,Random House/Disney,Hardcover,400,2025,2025,,2024/06/30,did-not-finish,did-not-finish (#12),did-not-finish,dnf @ 28%<br/><br/>just didn’t get into it. ,,,1,0
43801254,The Worst Best Man,Mia Sosa,"Sosa, Mia",,"=""0062909886""","=""9780062909886""",0,Avon,ebook,368,2020,2020,,2022/07/25,"romance, read-2022, did-not-finish","romance (#46), read-2022 (#51), did-not-finish (#6)",did-not-finish,"dnf @ 44%<br/><br/>i might come back to finish it at some point but right now it’s just not buzzing my brain, i think i’m not in a romance vibe so this put me deeper into the Reading Slump. ",,,0,0
45302789,"The Missing Page (Page & Sommers, #2)",Cat Sebastian,"Sebastian, Cat",,"=""""","=""9798201586973""",0,,ebook,236,2022,2022,,2023/01/27,"romance, read-2023, did-not-finish","romance (#57), read-2023 (#5), did-not-finish (#8)",did-not-finish,,,,0,0
55926057,"Indigo Ridge (The Edens, #1)",Devney Perry,"Perry, Devney",,"=""""","=""""",0,Devney Perry LLC,Kindle Edition,340,2021,2021,,2022/12/26,"romance, did-not-finish, read-2023","romance (#56), did-not-finish (#11), read-2023 (#26)",did-not-finish,"dnf @ 31%<br/><br/>sorry i just haven’t given a fuck about anything in this book yet, life is too short to keep reading this.",,,0,0
58100280,"The Cheat Sheet (The Cheat Sheet, #1)",Sarah       Adams,"Adams, Sarah",,"=""""","=""""",1,,Kindle Edition,306,2021,2021,,2023/05/12,"romance, read-2023, did-not-finish","romance (#61), read-2023 (#10), did-not-finish (#9)",did-not-finish,"dnf @ 11%<br/><br/>we GET IT. bree is better/cooler/quirkier/smarter and every other woman in the world is stupid and annoying. couldn’t stand another page of this book, omfg.",,,0,0
45422268,The Vanished Birds,Simon Jimenez,"Jimenez, Simon",,"=""0593128982""","=""9780593128985""",0,Del Rey,Hardcover,391,2020,2020,,2022/04/07,"read-2022, did-not-finish","read-2022 (#47), did-not-finish (#7)",did-not-finish,dnf @ 51%<br/><br/>another victim of my reading slump. i was really enjoying it but i’ve been trying to finish it since april so let’s be honest… but i will come back for it. probably.,,,0,0
60438355,"Terms and Conditions  (Dreamland Billionaires, #2)",Lauren Asher,"Asher, Lauren",,"=""""","=""""",0,Lauren Asher,Paperback,496,2022,2022,,2022/02/26,"romance, read-2022, did-not-finish","romance (#33), read-2022 (#27), did-not-finish (#5)",did-not-finish,"dnf @ 20%<br/><br/>iris is a good protagonist but declan is so fucking annoying, i can’t keep reading about him enough to get to any kind of redemption or growth arc for his character (if he ever gets that).",,,0,0
123166205,Wild Like Us (Special Edition Paperback),Krista Ritchie,"Ritchie, Krista",Becca Ritchie,"=""1950165590""","=""9781950165599""",1,K.B. Ritchie LLC,Paperback,462,2023,2020,2022/01/27,2022/01/27,"did-not-finish, read-2022","did-not-finish (#4), read-2022 (#17)",did-not-finish,"DNF @ 38% <br/><br/>this is the most uninteresting romance i’ve ever read with the most uninteresting characters i’ve ever seen, and i’m not even joking. this whole series was a train wreck but at least it was entertaining, this book was just sad to witness.",,,1,0
54189398,"The Spanish Love Deception (Love Deception, #1)",Elena  Armas,"Armas, Elena",,"=""1668002531""","=""9781668002537""",2,Elena Armas,ebook,487,2021,2021,2021/09/30,2021/08/24,"romance, did-not-finish, read-2021","romance (#5), did-not-finish (#3), read-2021 (#110)",did-not-finish,dnf @ 34% oh my fucking god catalina is annoying this whole book is so ANNOYING.,,,1,0
55119872,Black Water Sister,Zen Cho,"Cho, Zen",,"=""0425283437""","=""9780425283431""",0,Ace,Paperback,371,2021,2021,,2021/05/12,"did-not-finish, read-2021","did-not-finish (#2), read-2021 (#97)",did-not-finish,dnf @ 23%,,,0,0
49399658,Counting Down with You,Tashie Bhuiyan,"Bhuiyan, Tashie",,"=""1335209972""","=""9781335209979""",2,Inkyard Press,Hardcover,464,2021,2021,2021/05/04,2021/01/28,"did-not-finish, read-2021","did-not-finish (#1), read-2021 (#65)",did-not-finish,dnf @ 53%<br/><br/>i wanted to love this book so bad,,,1,0
235672421,Star Shipped,Cat Sebastian,"Sebastian, Cat",,"=""0063429586""","=""9780063429581""",0,Avon,Paperback,384,2026,2026,,2026/03/07,"to-read, coming-2026, romance","to-read (#175), coming-2026 (#8), romance (#99)",to-read,,,,0,0
12292260,Kill Anything That Moves: The Real American War in Vietnam (American Empire Project),Nick Turse,"Turse, Nick",,"=""0805086919""","=""9780805086911""",0,Metropolitan Books,Hardcover,370,2013,2013,,2026/03/07,"to-read, nonfiction","to-read (#174), nonfiction (#21)",to-read,,,,0,0
7815,The Year of Magical Thinking,Joan Didion,"Didion, Joan",,"=""1400078431""","=""9781400078431""",0,Vintage,Paperback,227,2007,2005,,2026/03/03,"to-read, nonfiction","to-read (#173), nonfiction (#20)",to-read,,,,0,0
243315012,Fishbone Cinderella,Elizabeth Lim,"Lim, Elizabeth",,"=""""","=""9798217092987""",0,Del Rey,Hardcover,448,2026,2026,,2026/02/28,"to-read, coming-2026, romance","to-read (#172), coming-2026 (#7), romance (#98)",to-read,,,,0,0
22847284,Grokking Algorithms An Illustrated Guide For Programmers and Other Curious People,Aditya Y. Bhargava,"Bhargava, Aditya Y.",,"=""1617292230""","=""9781617292231""",0,Manning Publications Co,Paperback,256,2015,2015,,2026/02/28,"to-read, nonfiction","to-read (#171), nonfiction (#19)",to-read,,,,0,0
30144474,"Batgirl, Vol. 3: Point Blank",Kelley Puckett,"Puckett, Kelley",Various,"=""1401265855""","=""9781401265854""",4,DC Comics,Paperback,288,2017,2003,2026/02/22,2026/02/15,comics,comics (#96),read,,,,1,0
27405513,"Batgirl, Vol. 2: To the Death",Kelley Puckett,"Puckett, Kelley",Various,"=""1401263526""","=""9781401263522""",4,DC Comics,Paperback,320,2016,2002,2026/02/21,2026/02/15,comics,comics (#95),read,,,,1,0
25810117,"Batgirl, Vol. 1: Silent Knight",Kelley Puckett,"Puckett, Kelley","Scott E.  Peterson, Damion Scott, Chuck Dixon, Koi Turnbull, Dale Eaglesham, Mike Deodato, Robert Campanella, Pablo Raimondi","=""1401260721""","=""9781401260729""",4,DC Comics,Paperback,328,2001,2001,2026/02/20,2026/02/15,"comics, read-2026","comics (#97), read-2026 (#3)",read,"te amo cassandra cain!!! tem tantas histórias lindas, a arte deixa a desejar em alguns momentos (efeito dos anos 2000), mas é bonita! a relação da cass e da barbara é uma das minhas partes preferidas",,,1,0
214269353,I Leave It Up to You,Jinwoo Chong,"Chong, Jinwoo",,"=""0593727053""","=""9780593727058""",0,Ballantine Books,Hardcover,311,2025,2025,,2026/02/26,"to-read, romance","to-read (#170), romance (#97)",to-read,,,,0,0
24507092,To Hell and Back: The Last Train from Hiroshima (Asia/Pacific/Perspectives),Charles Pellegrino,"Pellegrino, Charles",,"=""1442250585""","=""9781442250581""",5,Rowman & Littlefield Publishers,Hardcover,432,2015,2010,2026/02/26,2026/02/23,nonfiction,nonfiction (#18),read,"muito bem escrito, partiu meu coração! é aterrorizante pensar que algo assim já aconteceu e pode acontecer de novo. esse livro me fez pensar muito, acho que todos deveriam ler, apesar de ser tão pesado.",,,1,0
61049,Autobiography of Red,Anne Carson,"Carson, Anne",Stesichorus,"=""037570129X""","=""9780375701290""",5,Vintage Books,Paperback,160,1999,1998,2026/02/22,2024/09/16,read-2026,read-2026 (#6),read,"eu amei, é muito emocionante e surpreendente! o tipo de livro que você relê mil vezes e descobre coisas novas. ",,,1,0
18691062,"Batman: Bruce Wayne, Fugitive",Greg Rucka,"Rucka, Greg","Ed Brubaker, Devin Grayson, Chuck Dixon, Kelley Puckett, Rick Leonardi, Michael Golden, Brian Bolland, Trevor McCarthy, Damion Scott, Scott McDaniel, Dave Ross, William Rosado, Roger Robinson, Sean Phillips, Phil Noto, Steve Leiber, Sergio Cariello, Dennis O'Neil, Geoff Johns","=""1401246826""","=""9781401246822""",4,DC Comics,Paperback,418,2014,2002,2026/02/15,2024/03/31,"comics, read-2026","comics (#52), read-2026 (#5)",read,"é um final muito digno para esse arco, eu simplesmente amei a exploração do personagem do batman e das suas relações com as pessoas na vida dele. pra mim, as melhores histórias são as que não tem medo de fazer isso, de reconhecer os defeitos dele sem perder de vista quem ele é. e eu defenderia a cassandra cain com a minha vida!!",,,1,0
106059,"Batman: Bruce Wayne, Murderer?",Greg Rucka,"Rucka, Greg","Chuck Dixon, Steve Lieber, Jesse Delperdang, Trevor McCarthy, Scott McDaniel, Roger Robinson, Damion Scott, Pete Woods, Ed Brubaker, Devin Grayson, Kelley Puckett, Rick Burchett, Rick Leonardi","=""1563899132""","=""9781563899133""",4,DC Comics,Paperback,552,2002,2002,2026/02/13,2024/03/31,read-2026,read-2026 (#4),read,"maravilhosa, gosto muito das histórias do universo do batman dos anos 2000. tem tudo que eu gosto nas hqs do batman: um mistério muito envolvente, os personagens incríveis, uma arte linda e a atmosfera de gotham que eu amo tanto. estou muito ansiosa pra ler o desfecho dessa história!",,,1,0
247292749,"My Dear Detective: Mitsuko’s Case Files, Vol. 7",Natsumi Ito,"Ito, Natsumi",Arthur Miura,"=""1960186310""","=""9781960186317""",5,Omoi,Kindle Edition,,2026,,2026/02/04,2026/02/04,"mangas, read-2026","mangas (#151), read-2026 (#2)",read,"eu amo essa história tanto, mitsuki e saku são tão especiais!!!",,,1,0
230528318,"Absolute Martian Manhunter, Vol. 1: Martian Vision",Deniz Camp,"Camp, Deniz",Javier Rodriguez,"=""1799505219""","=""9781799505211""",0,DC Comics,Paperback,160,2025,2025,,2026/02/02,"to-read, comics","to-read (#169), comics (#94)",to-read,,,,0,0
241039381,The Last Contract of Isako,Fonda Lee,"Lee, Fonda",,"=""0316568635""","=""9780316568630""",0,Orbit,Hardcover,528,2026,2026,,2026/02/02,"to-read, coming-2026","to-read (#168), coming-2026 (#6)",to-read,,,,0,0
43352954,This Is How You Lose the Time War,Amal El-Mohtar,"El-Mohtar, Amal",Max Gladstone,"=""""","=""""",5,Saga Press,ebook,209,2019,2019,2020/01/02,2020/12/15,read-2020,read-2020 (#1),read,,,,2,0
51398,Teaching Critical Thinking: Practical Wisdom,bell hooks,"hooks, bell",,"=""0415968208""","=""9780415968201""",0,Routledge,Paperback,191,2009,2009,,2026/01/26,"to-read, nonfiction","to-read (#167), nonfiction (#17)",to-read,,,,0,0
250792,Ain't I a Woman: Black Women and Feminism,bell hooks,"hooks, bell",,"=""089608129X""","=""9780896081291""",0,South End Pr,Paperback,205,1981,1981,,2026/01/26,"to-read, nonfiction","to-read (#166), nonfiction (#16)",to-read,,,,0,0
231126917,Cabaret in Flames,Hache Pueyo,"Pueyo, Hache",,"=""1250370450""","=""9781250370457""",0,Tordotcom,Hardcover,160,2026,2026,,2026/01/26,"to-read, coming-2026","to-read (#165), coming-2026 (#5)",to-read,,,,0,0
246999007,Mestra,Madeline Miller,"Miller, Madeline",,"=""1037206126""","=""9781037206122""",0,Bloomsbury,Hardcover,64,2026,2026,,2026/01/26,"to-read, coming-2026","to-read (#164), coming-2026 (#4)",to-read,,,,0,0
239982876,The Last Woman on Earth (The Devil at the End #1),Bex Benjamin,"Benjamin, Bex",,"=""1068269812""","=""9781068269813""",0,,Kindle Edition,344,2025,2025,,2026/01/20,to-read,to-read (#163),to-read,,,,0,0
204642474,Catwoman: Trail of the Catwoman,Ed Brubaker,"Brubaker, Ed",Darwyn Cooke,"=""1779527284""","=""9781779527288""",4,DC Comics,Paperback,336,2024,2008,2026/01/16,2026/01/11,read-2026,read-2026 (#1),read,"muito bom! a selina é uma personagem que apaixona rapidamente pelo seu jeito sarcástico, forte e inteligente e todos os outros personagens também são muito distintos e interessantes.<br/>o enredo não deixa a desejar, é uma história muito envolvente sobre corrupção e as pessoas que são esquecidas e ignoradas pela sociedade, eu achei a mulher-gato uma grande justiceira, amei a jornada dela.<br/>minha única crítica é que o último arco nos deixa querendo mais, mas como introdução da personagem imagino que é essa a intenção. ",,,1,0
235854914,I Hope This Finds You,Ann Liang,"Liang, Ann",,"=""""","=""9798225013813""",0,Scholastic,ebook,103,2025,2025,,2026/01/07,"to-read, romance","to-read (#162), romance (#96)",to-read,,,,0,0
245194290,The Lost Life of Sylvia Song,Ann Liang,"Liang, Ann",,"=""1335008993""","=""9781335008992""",0,HarperCollins US,Hardcover,384,2027,,,2026/01/07,"to-read, coming-2027, romance","to-read (#161), coming-2027 (#1), romance (#95)",to-read,,,,0,0
